{
  "schema_version": "supply-chain-evidence/v1",
  "generated_at": "2026-09-11T00:00:00Z",
  "status": "approved",
  "manual_manifest": {
    "packages": [
      {
        "name": "fastapi",
        "ecosystem": "pypi",
        "version": "0.137.0",
        "registry_url": "https://pypi.org/pypi/fastapi/0.137.0/json",
        "owner": "Sebastián Ramírez <tiangolo@gmail.com>",
        "repository_url": "https://github.com/fastapi/fastapi",
        "license": "MIT",
        "published_at": "2026-06-14T12:51:29Z",
        "checked_at": "2026-08-29T06:37:13Z",
        "reviewer": "project owner approved exact version after Phoenix compatibility review",
        "registry_response_sha256": "dce87dbbdfa8aa905a7061e869bd7969f196cbd2a60e93640cee56b9997df4f1"
      },
      {
        "name": "langgraph",
        "ecosystem": "pypi",
        "version": "1.2.11",
        "registry_url": "https://pypi.org/pypi/langgraph/1.2.11/json",
        "owner": "langchain-ai (source repository owner; PyPI JSON has no author or maintainer field)",
        "repository_url": "https://github.com/langchain-ai/langgraph/tree/main/libs/langgraph",
        "license": "MIT",
        "published_at": "2026-08-11T14:00:35.494718Z",
        "checked_at": "2026-08-29T03:45:00Z",
        "reviewer": "project owner approved exact version",
        "registry_response_sha256": "850c84cc877c90ffe8003bd043aed799339964ee28e325ba845dd1be3fd0ebaa"
      },
      {
        "name": "langgraph-checkpoint-postgres",
        "ecosystem": "pypi",
        "version": "3.1.2",
        "registry_url": "https://pypi.org/pypi/langgraph-checkpoint-postgres/3.1.2/json",
        "owner": "langchain-ai (source repository owner; PyPI JSON has no author or maintainer field)",
        "repository_url": "https://github.com/langchain-ai/langgraph/tree/main/libs/checkpoint-postgres",
        "license": "MIT",
        "published_at": "2026-08-07T20:39:58.994834Z",
        "checked_at": "2026-08-29T03:45:00Z",
        "reviewer": "project owner approved exact version",
        "registry_response_sha256": "234b49dfd9744aef8aae10d702b41f051f1daedf8c85084d2ec7c9ae3cd5fba4"
      },
      {
        "name": "pgvector",
        "ecosystem": "pypi",
        "version": "0.5.0",
        "registry_url": "https://pypi.org/pypi/pgvector/0.5.0/json",
        "owner": "Andrew Kane <andrew@ankane.org>",
        "repository_url": "https://github.com/pgvector/pgvector-python",
        "license": "MIT",
        "published_at": "2026-07-06T18:27:27.767083Z",
        "checked_at": "2026-09-11T00:00:00Z",
        "reviewer": "Phase 06.3 package legitimacy audit; exact PyPI metadata and source repository reviewed",
        "registry_response_sha256": "e0463e7eaa856c8f875db703a94600a7d63acbc722cd9fad06f5d9f5deed9d55"
      },
      {
        "name": "langfuse",
        "ecosystem": "pypi",
        "version": "4.14.0",
        "registry_url": "https://pypi.org/pypi/langfuse/4.14.0/json",
        "owner": "langfuse <developers@langfuse.com>",
        "repository_url": "https://github.com/langfuse/langfuse-python",
        "license": "MIT",
        "published_at": "2026-07-10T11:33:39.153848Z",
        "checked_at": "2026-09-11T00:00:00Z",
        "reviewer": "Phase 06.3 package legitimacy audit; exact PyPI metadata and source repository reviewed; dev-only",
        "registry_response_sha256": "9e0c0aaf7cee85e2c32560d79a271eecc4d67be05bb10a5e6a1c178be966b888"
      },
      {
        "name": "eventsource-parser",
        "ecosystem": "npm",
        "version": "3.1.0",
        "registry_url": "https://registry.npmjs.org/eventsource-parser/3.1.0",
        "owner": "rexxars",
        "repository_url": "https://github.com/rexxars/eventsource-parser",
        "license": "MIT",
        "published_at": "2026-05-27T20:55:51.466Z",
        "checked_at": "2026-08-29T03:45:00Z",
        "reviewer": "project owner approved exact version",
        "registry_response_sha256": "8af106a91c42739f9e7ea2dcc2d56965a7c30129f28763ab99caa14f5a5eec32"
      },
      {
        "name": "arize-phoenix",
        "ecosystem": "pypi",
        "version": "18.1.0",
        "registry_url": "https://pypi.org/pypi/arize-phoenix/18.1.0/json",
        "owner": "Arize AI <phoenix-devs@arize.com>",
        "repository_url": "https://github.com/Arize-ai/phoenix",
        "license": "Elastic-2.0",
        "published_at": "2026-07-17T05:17:24Z",
        "checked_at": "2026-08-29T06:37:13Z",
        "reviewer": "project owner authorized replacement after 20.3.0 and 20.4.0 both failed Python 3.11 import with Phoenix mutable-default dataclass error",
        "registry_response_sha256": "60d4d7616321f77bb3610f04690fe2b21b49a743454066aaafbf01b078ecfc88"
      },
      {
        "name": "arize-phoenix-otel",
        "ecosystem": "pypi",
        "version": "0.17.1",
        "registry_url": "https://pypi.org/pypi/arize-phoenix-otel/0.17.1/json",
        "owner": "Arize AI <phoenix-devs@arize.com>",
        "repository_url": "https://github.com/Arize-ai/phoenix",
        "license": "Apache-2.0",
        "published_at": "2026-08-10T17:36:28.038156Z",
        "checked_at": "2026-08-29T03:45:00Z",
        "reviewer": "project owner approved exact version",
        "registry_response_sha256": "4291cc504be23f86ea4d15b7defddc519bdbf78c75a5d82d05d6387477ca31de"
      },
      {
        "name": "openinference-instrumentation-langchain",
        "ecosystem": "pypi",
        "version": "0.1.72",
        "registry_url": "https://pypi.org/pypi/openinference-instrumentation-langchain/0.1.72/json",
        "owner": "OpenInference Authors <oss@arize.com>",
        "repository_url": "https://github.com/Arize-ai/openinference/tree/main/python/instrumentation/openinference-instrumentation-langchain",
        "license": "Apache-2.0",
        "published_at": "2026-08-25T05:32:52.232175Z",
        "checked_at": "2026-08-29T03:45:00Z",
        "reviewer": "project owner approved exact version",
        "registry_response_sha256": "d1a417cdf04a0f6a42ff3124e382580c6590e6cf2e0a05137e7b322ad80a596f"
      },
      {
        "name": "pillow",
        "ecosystem": "pypi",
        "version": "12.3.0",
        "registry_url": "https://pypi.org/pypi/pillow/12.3.0/json",
        "owner": "Jeffrey Alex Clark and Pillow contributors",
        "repository_url": "https://github.com/python-pillow/Pillow",
        "license": "MIT-CMU",
        "published_at": "2026-07-01T11:53:27.808291Z",
        "checked_at": "2026-08-31T05:10:18Z",
        "reviewer": "Phase 3 approved image-safety dependency; official PyPI metadata and current security fixes reviewed",
        "registry_response_sha256": "63159d6013cf20f98ff9caeb8b0b210b7f5877975587f4265397ffb0fd8c72a0"
      },
      {
        "name": "python-multipart",
        "ecosystem": "pypi",
        "version": "0.0.32",
        "registry_url": "https://pypi.org/pypi/python-multipart/0.0.32/json",
        "owner": "Kludex (owner); Andrew Dunham and Tom Christie (maintainers)",
        "repository_url": "https://github.com/Kludex/python-multipart",
        "license": "Apache-2.0",
        "published_at": "2026-06-04T16:18:57Z",
        "checked_at": "2026-08-31T06:00:00Z",
        "reviewer": "Phase 3 multipart upload dependency reviewed against official PyPI metadata and pinned artifact hash",
        "registry_response_sha256": "a031fb02f69ea8125edc9473c7bc8d3876556de8812dcd694d76482631d7fc2b"
      },
      {
        "name": "promptfoo",
        "ecosystem": "npm",
        "version": "0.122.0",
        "registry_url": "https://registry.npmjs.org/promptfoo/0.122.0",
        "owner": "npm maintainers: sklein12, mdangelo, ianw, justinbeckwith, faizanminhas",
        "repository_url": "https://github.com/promptfoo/promptfoo",
        "license": "MIT",
        "published_at": "2026-08-04T17:57:34.633Z",
        "checked_at": "2026-08-29T03:45:00Z",
        "reviewer": "project owner approved exact version",
        "registry_response_sha256": "d575776647a7cbdc3acfdbdb4cb0d47308f463280a6ac32ce050cc57f274b531"
      }
    ],
    "manifest_sha256": "41f783718704276b4c452590490965b513bdc83c23cef0e844d2cc19c815f9cb"
  }
}
